A1: Kårrestaurangen
A2: Flaska 33 cl | E2: Poäng
A4: 1 | B4: Peter M | C4: H | D4: 4.220 | E4: 55
A5: 2 | B5: David R | C5: E | D5: 4.4 | E5: 50
A6: 3 | B6: Peter H | C6: D | D6: 4.7939999999999996 | E6: 47
A7: 4 | B7: Erik S | C7: E | D7: 4.9 | E7: 44
A8: 5 | B8: Jonas E | C8: E | D8: 4.907 | E8: 42
A9: 6 | B9: Karl J | C9: Z | D9: 4.9989999999999997 | E9: 40
A10: 7 | B10: Daniel E | C10: I | D10: 5.0270000000000001 | E10: 38
A11: 8 | B11: David I | C11: H | D11: 5.2 | E11: 33
A12: 8 | B12: Peter F | C12: M | D12: 5.2 | E12: 33
A13: 8 | B13: Krister O | C13: KFKB | D13: 5.2 | E13: 33
A14: 8 | B14: Mikael N | C14: K | D14: 5.2 | E14: 33
A15: 12 | B15: Fredrik Ö | C15: M | D15: 5.2009999999999996 | E15: 29
A16: 13 | B16: Daniel R | C16: I | D16: 5.4 | E16: 28
A17: 14 | B17: Torun | C17: V | D17: 5.5750000000000002 | E17: 27
A18: 15 | B18: Johan L | C18: F | D18: 5.6 | E18: 26
A19: 16 | B19: Anders S | C19: IT | D19: 5.680 | E19: 25
A20: 17 | B20: Emanuel | C20: I | D20: 5.7009999999999996 | E20: 24
A21: 18 | B21: Roberto Z | C21: CIRC | D21: 5.8239999999999998 | E21: 23
A22: 19 | B22: Sebastian F | C22: CIRC | D22: 6.0 | E22: 22
A23: 20 | B23: Linus R | C23: H | D23: 6.0670000000000002 | E23: 21
A24: 21 | B24: Johannes T | C24: K | D24: 6.1 | E24: 20
A25: 22 | B25: Emil L | C25: TD | D25: 6.1340000000000003 | E25: 19
A26: 23 | B26: Andreas J | C26: F | D26: 6.2610000000000001 | E26: 18
A27: 24 | B27: Theres A | C27: H | D27: 6.3 | E27: 17
A28: 25 | B28: Kristin | C28: E | D28: 6.4 | E28: 16
A29: 26 | B29: Damir L | C29: D | D29: 6.4139999999999997 | E29: 15
A30: 27 | B30: Enan A | C30: CIRC | D30: 6.4770000000000003 | E30: 14
A31: 28 | B31: Patrik A | C31: D | D31: 6.4850000000000003 | E31: 13
A32: 29 | B32: Hannes | C32: V | D32: 6.6 | E32: 11.5
A33: 29 | B33: David C | C33: M | D33: 6.6 | E33: 11.5
A34: 31 | B34: Ilse R | C34: I | D34: 6.952 | E34: 10
A35: 32 | B35: Timo N | C35: F | D35: 7.1310000000000002 | E35: 9
A36: 33 | B36: Stefan J | C36: IT | D36: 7.3369999999999997 | E36: 8
A37: 34 | B37: Andreas J | C37: D | D37: 7.4560000000000004 | E37: 7
A38: 35 | B38: David | C38: V | D38: 7.460 | E38: 6
A39: 36 | B39: Niklas S | C39: IT | D39: 7.758 | E39: 5
A40: 37 | B40: Kajsa H | C40: TD | D40: 9.343 | E40: 4
A41: 38 | B41: Malin N | C41: M | D41: 10.236000000000001 | E41: 3
A42: 39 | B42: Manella | C42: K | D42: 10.324999999999999 | E42: 2
A43: 40 | B43: Louise L | C43: KFKB | D43: 14.7 | E43: 1
A45: Flaska 33 cl Emilia | E45: Poäng
A47: 1 | B47: Torun | C47: V | D47: 5.5750000000000002 | E47: 10
A48: 2 | B48: Theres A | C48: H | D48: 6.3 | E48: 5
A49: 3 | B49: Kristin | C49: E | D49: 6.4 | E49: 2
A50: 4 | B50: Damir L | C50: D | D50: 6.4139999999999997 | E50: 0
A51: 5 | B51: Ilse R | C51: I | D51: 6.952 | E51: 0
A52: 6 | B52: Kajsa H | C52: TD | D52: 9.343 | E52: 0
A53: 7 | B53: Malin N | C53: M | D53: 10.236000000000001 | E53: 0
A54: 8 | B54: Manella | C54: K | D54: 10.324999999999999 | E54: 0
A55: 9 | B55: Louise L | C55: KFKB | D55: 14.7 | E55: 0
A57: Sejdel 0,5 L | E57: Poäng
A59: 1 | B59: Peter M | C59: H | D59: 4.900 | E59: 45
A60: 2 | B60: Johan T | C60: V | D60: 5.000 | E60: 40
A61: 3 | B61: Putt | C61: D | D61: 5.170 | E61: 37
A62: 4 | B62: Patrik H | C62: E | D62: 5.7060000000000004 | E62: 34
A63: 5 | B63: Erik S | C63: F | D63: 5.7220000000000004 | E63: 32
A64: 6 | B64: Mattias A | C64: M | D64: 6.2320000000000002 | E64: 30
A65: 7 | B65: Mikael T | C65: K | D65: 6.5640000000000001 | E65: 28
A66: 8 | B66: Mårten B | C66: H | D66: 6.9580000000000002 | E66: 26
A67: 9 | B67: Martin L | C67: KFKB | D67: 7.032 | E67: 24
A68: 10 | B68: Nils L | C68: E | D68: 7.2619999999999996 | E68: 22
A69: 11 | B69: Walle | C69: D | D69: 10.275 | E69: 20
A70: 12 | B70: Henrik H | C70: I | D70: 11.503 | E70: 18
A71: 13 | B71: Anders S | C71: IT | D71: 12.390 | E71: 16
A73: Sejdel 1,0 L | E73: Poäng
A75: 1 | B75: Peter F | C75: M | D75: 8.7929999999999993 | E75: 45
A76: 2 | B76: Jonny F | C76: H | D76: 10.510999999999999 | E76: 40
A77: 3 | B77: Johannes A | C77: E | D77: 10.648999999999999 | E77: 37
A78: 4 | B78: Johan T | C78: V | D78: 11.12 | E78: 34
A79: 5 | B79: Kristoffer W | C79: F | D79: 11.734 | E79: 32
A80: 6 | B80: Erik S | C80: F | D80: 13.167 | E80: 30
A81: 7 | B81: Olof J | C81: M | D81: 13.808999999999999 | E81: 28
A82: 8 | B82: Martin L | C82: KFKB | D82: 15.132999999999999 | E82: 26
A83: 9 | B83: Gustav B | C83: H | D83: 15.352 | E83: 24
A84: 10 | B84: Johan W | C84: E | D84: 15.72 | E84: 22
A85: 11 | B85: Putt | C85: D | D85: 16.347999999999999 | E85: 20
A86: 12 | B86: Arsenal | C86: Z | D86: 21.928000000000001 | E86: 18
A87: 13 | B87: Anders S | C87: IT | D87: 26.387 | E87: 16
A88: 14 | B88: Anders B | C88: I | D88: 27.681999999999999 | E88: 14
A89: 15 | B89: Peter H | C89: D | D89: 41.465000000000003 | E89: 12
A90: 16 | B90: Johannes | C90: K | D90: 46.743000000000002 | E90: 10
A91: 17 | B91: Therese E | C91: I | D91: 53.606000000000002 | E91: 8
A93: Bierstaphette ( 5 x 33 cl flaska ) | E93: poäng
A95: 1 | B95: H | D95: 29.6 | E95: 100
A96: 2 | B96: M | D96: 38.8 | E96: 80
A97: 3 | B97: I | D97: 44.892000000000003 | E97: 60
A98: 4 | B98: KFKB | D98: 45.274000000000001 | E98: 50
A99: 5 | B99: D | D99: 55.697000000000003 | E99: 40
A101: Total poängsummering
A103: 1 | B103: H | E103: =(55+33+21+17+45+26+40+24+100+5) -> 366
A104: 2 | B104: E | E104: =(50+44+42+16+34+22+37+22+2) -> 269
A105: 3 | B105: M | E105: =(33+29+11.5+3+30+45+28+80) -> 259.5
A106: 4 | B106: D | E106: =(47+15+13+7+37+20+20+12+40) -> 211
A107: 5 | B107: I | E107: =(38+28+24+10+18+14+8+60) -> 200
A108: 6 | B108: F | E108: =(26+18+9+32+32+30) -> 147
A109: 7 | B109: KFKB | E109: =(33+1+24+26+50) -> 134
A110: 8 | B110: V | E110: =(27+11.5+6+10+40+34) -> 128.5
A111: 9 | B111: K | E111: =(33+20+2+28+10) -> 93
A112: 10 | B112: IT | E112: =(25+8+5+16+16) -> 70
A113: 11 | B113: CIRC | E113: =(23+22+14) -> 59
A114: 12 | B114: Z | E114: =(40+18) -> 58
A115: 13 | B115: TD | E115: =(19+4) -> 23