B2: Oktoberhäfv | C2: .021010
B5: Flaska 33cl
A7: 1 | B7: Trotsky | C7: KGB | D7: 3.4
A8: 2 | B8: Kaptenen | C8: EKAK | D8: 3.9319999999999999
A9: 3 | B9: Buzzie | C9: EKAK | D9: 4.0049999999999999
A10: 4 | B10: Junior | C10: M-Rustet | D10: 4
A11: 5 | B11: Kalle Anka -01 | C11: EWU | D11: 4.1
A12: 6 | B12: Lenin | C12: KGB | D12: 4.2
A13: 7 | B13: Patrik H | C13: E | D13: 4.2
A14: 8 | B14: Broder Tuck | C14: EWU | D14: 4.3920000000000003
A15: 9 | B15: Brutus | C15: EWU | D15: 4.4
A16: 10 | B16: Jarve | C16: H | D16: 4.4
A17: 11 | B17: Ekman | C17: Doktorand | D17: 4.4
A18: 12 | B18: Thomas O'Malley | C18: EWU | D18: 4.42
A19: 13 | B19: Ecke | C19: DKV | D19: 4.4
A20: 14 | B20: Merlund | C20: H | D20: 4.5
A21: 15 | B21: Kufe Knyck | C21: EKAK | D21: 4.5
A22: 16 | B22: Nina | C22: Bamse | D22: 4.5
A23: 17 | B23: Kristin | C23: E | D23: 4.5890000000000004
A24: 18 | B24: Neo | C24: D | D24: 4.6
A25: 19 | B25: Stalin | C25: KGB | D25: 4.6
A26: 20 | B26: Kapitalix | C26: M.A.K. | D26: 4.6
A27: 21 | B27: Peter Falk | C27: M | D27: 4.7
A28: 22 | B28: Igor P | C28: KGB | D28: 4.7
A29: 23 | B29: Jonas E | C29: E | D29: 4.7
A30: 24 | B30: Eric S | C30: E | D30: 4.7
A31: 25 | B31: Nappe | C31: CCC | D31: 4.9
A32: 26 | B32: Åke | C32: E6 | D32: 4.9
A33: 27 | B33: Jonas S | C33: D | D33: 4.9
A34: 28 | B34: Kalle Anka | C34: EKAK | D34: 4.9
A35: 29 | B35: Kajsa | C35: Gruppkommittén | D35: 4.9
A36: 30 | B36: Falun | C36: H | D36: 5
A37: 31 | B37: Sussie | C37: E-styret | D37: 5
A38: 32 | B38: Mirakulix | C38: M.A.K. | D38: 5
A39: 33 | B39: Jimmy | C39: E6 | D39: 5.1
A40: 34 | B40: Linus | C40: H | D40: 5.2
A41: 35 | B41: Nina T | C41: E | D41: 5.3
A42: 36 | B42: Judas | C42: CCC | D42: 5.3
A43: 37 | B43: Peter H | C43: D | D43: 5.3
A44: 38 | B44: Majestix | C44: M.A.K. | D44: 5.4
A45: 39 | B45: dB! | C45: CCC | D45: 5.6
A46: 40 | B46: Ewok | C46: F | D46: 5.7
A47: 41 | B47: Markus | C47: E | D47: 5.8
A48: 42 | B48: Helena | C48: Bamse | D48: 5.8
A49: 43 | B49: Therese | C49: H | D49: 5.9
A50: 44 | B50: Björn | C50: ERUS | D50: 7.3
A52: Flaska 33 cl Emilia
A54: 1 | B54: Nina | C54: Bamse | D54: 4.5
A55: 2 | B55: Kristin | C55: E | D55: 4.5890000000000004
A56: 3 | B56: Kajsa | C56: Gruppkommittén | D56: 4.9
A57: 4 | B57: Sussie | C57: E-styret | D57: 5
A58: 5 | B58: Nina T | C58: E | D58: 5.3
A59: 6 | B59: Helena | C59: Bamse | D59: 5.8
A60: 7 | B60: Therese | C60: H | D60: 5.9
B63: Sejdel 0.5L
A65: 1 | B65: Gaylord | C65: GU | D65: 3.7349999999999999
A66: =A65+1 -> 2 | B66: Kufe Knyck | C66: EKAK | D66: 3.9020000000000001
A67: =A66+1 -> 3 | B67: Kaptenen | C67: EKAK | D67: 4.2089999999999996
A68: =A67+1 -> 4 | B68: Trotsky | C68: KGB | D68: 4.3739999999999997
A69: =A68+1 -> 5 | B69: Kalle Anka -01 | C69: EWU | D69: 4.4109999999999996
A70: =A69+1 -> 6 | B70: Thomas O'Malley | C70: EWU | D70: 4.5359999999999996
A71: =A70+1 -> 7 | B71: Björn | C71: ERUS | D71: 4.8449999999999998
A72: =A71+1 -> 8 | B72: Lenin | C72: KGB | D72: 4.9109999999999996
A73: =A72+1 -> 9 | B73: Patrik | C73: E | D73: 5.15
A74: =A73+1 -> 10 | B74: Ingo | C74: pHoto | D74: 5.5529999999999999
A75: =A74+1 -> 11 | B75: Jonas E | C75: E | D75: 5.5949999999999998
A76: =A75+1 -> 12 | B76: Jimmy | C76: E6 | D76: 5.798
A77: =A76+1 -> 13 | B77: Judas | C77: CCC | D77: 5.8769999999999998
A78: =A77+1 -> 14 | B78: Jonas S | C78: D | D78: 5.976
A79: =A78+1 -> 15 | B79: Nina | C79: Bamse | D79: 6.0019999999999998
A80: =A79+1 -> 16 | B80: Eric S | C80: E | D80: 6.1669999999999998
A81: =A80+1 -> 17 | B81: Rasmus | C81: E | D81: 6.3079999999999998
A82: =A81+1 -> 18 | B82: Johannes | C82: E | D82: 6.8019999999999996
A83: =A82+1 -> 19 | B83: Igor P | C83: KGB | D83: 6.8209999999999997
A84: =A83+1 -> 20 | B84: Kajsa | C84: Gruppkommittén | D84: 7.4320000000000004
A85: =A84+1 -> 21 | B85: Ewok | C85: F | D85: 7.907
A86: =A85+1 -> 22 | B86: Kristin | C86: E | D86: 9.1430000000000007
A87: 23 | B87: Johannes T | C87: K | D87: 9.1440000000000001
A88: 24 | B88: Helena | C88: Bamse | D88: 11.695
A90: Sejdel 1,0 L
A92: 1 | B92: Gaylord | C92: GU | D92: 5.6120000000000001
A93: 2 | B93: Kaptenen | C93: EKAK | D93: 6.7450000000000001
A94: 3 | B94: Trotsky | C94: KGB | D94: 7.9729999999999999
A95: 4 | B95: dB! | C95: CCC | D95: 10.837
A96: 5 | B96: Johannes | C96: E | D96: 12.927
A97: 6 | B97: Ewok | C97: F | D97: 14.227
A98: 7 | B98: Helena | C98: Bamse | D98: 23.837
A99: 8 | B99: Kristin | C99: E | D99: 28.306000000000001
A100: 9 | B100: Mikaela | C100: E | D100: 48.271000000000001
A103: EKAK skulle vilja tacka EWU för hjälpen och Pripps för den snabba Øhlen.